[
  {
    "id": "0xorder001",
    "market": "0x1234567890abcdef1234567890abcdef1234567890abcdef1234567890abcdef",
    "side": "BUY",
    "status": "LIVE",
    "price": "0.43",
    "original_size": "100.0",
    "size_matched": "0",
    "size_remaining": "100.0",
    "token_id": "1111111111111111111111111111111111111111111111111111111111111111",
    "type": "GTC",
    "created_at": "2026-07-23T09:00:00Z",
    "owner": "0xuser0000000000000000000000000000000000000001"
  }
]